Object Number,Is Highlight,Is Timeline Work,Is Public Domain,Object ID,Gallery Number,Department,AccessionYear,Object Name,Title,Culture,Period,Dynasty,Reign,Portfolio,Constituent ID,Artist Role,Artist Prefix,Artist Display Name,Artist Display Bio,Artist Suffix,Artist Alpha Sort,Artist Nationality,Artist Begin Date,Artist End Date,Artist Gender,Artist ULAN URL,Artist Wikidata URL,Object Date,Object Begin Date,Object End Date,Medium,Dimensions,Credit Line,Geography Type,City,State,County,Country,Region,Subregion,Locale,Locus,Excavation,River,Classification,Rights and Reproduction,Link Resource,Object Wikidata URL,Metadata Date,Repository,Tags,Tags AAT URL,Tags Wikidata URL
39.148.1,False,False,True,7578,713,The American Wing,1939.0,Sofa,Sofa,American,,,,,,,,,,,,,,,,,,ca. 1820,1817,1820,Mahogany,34 1/2 x 83 1/2 x 25 in. (87.6 x 212.1 x 63.5 cm),"Bequest of May Blackstone Huntington, 1938",Made in,Boston,,,United States,,,,,,,,,http://www.metmuseum.org/art/collection/search/7578,https://www.wikidata.org/wiki/Q116338491,,"Metropolitan Museum of Art, New York, NY",,,
60.114,False,False,True,7579,774,The American Wing,1960.0,Sofa,Sofa,American,,,,,,,,,,,,,,,,,,1760–90,1760,1790,Wood,39 3/4 x 88 1/4 x 30 1/2 in. (101 x 224.2 x 77.5 cm),"Gift of Mr. and Mrs. J. Carl De La Cour Jr., 1960",Probably made in,Philadelphia,,,United States,,,,,,,,,http://www.metmuseum.org/art/collection/search/7579,https://www.wikidata.org/wiki/Q116338452,,"Metropolitan Museum of Art, New York, NY",,,
61.254,False,True,False,7580,,The American Wing,1961.0,Sofa,Sofa,American,,,,,205,Maker, ,Ernest F. Hagen, , ,"Hagen, Ernest F.",American,          ,9999      ,,,,ca. 1898,1895,1898,"Mahogany, cane",36 x 59 5/8 x 30 in. (91.4 x 151.4 x 76.2 cm),"Gift of Lee McCanliss, 1961",Made in,New York,,,United States,,,,,,,,,http://www.metmuseum.org/art/collection/search/7580,,,"Metropolitan Museum of Art, New York, NY",,,
65.58,False,False,True,7581,733,The American Wing,1965.0,Sofa,Sofa,American,,,,,,,,,,,,,,,,,,ca. 1820,1817,1820,"Mahogany, ash, maple, pine",34 1/2 x 98 1/2 x 27 in. (87.6 x 250.2 x 68.6 cm),"Friends of the American Wing Fund, 1965",Made in,New York,,,United States,,,,,,,,,http://www.metmuseum.org/art/collection/search/7581,https://www.wikidata.org/wiki/Q116338405,,"Metropolitan Museum of Art, New York, NY",,,
66.108.1,False,False,True,7582,774,The American Wing,1966.0,Sofa,Sofa,American,,,,,,,,,,,,,,,,,,1790–1805,1790,1805,"Mahogany, satinwood inlay",36 3/4 x 77 13/16 x 30 1/8 in. (93.3 x 197.6 x 76.5 cm),"Given in memory of George Drew Egbert and Estelle Powers Egbert, by their children, 1966",Made in,New York,,,United States,,,,,,,,,http://www.metmuseum.org/art/collection/search/7582,https://www.wikidata.org/wiki/Q116338383,,"Metropolitan Museum of Art, New York, NY",,,
